{
  "pack_id": "china-ev-brief",
  "deck_goal": "Summarize the policy and market implications of China's EV export growth.",
  "audience": "Strategy leaders evaluating cross-border EV expansion",
  "source_units": [
    {
      "unit_id": "src-01:sec-01",
      "source_id": "src-01",
      "source_title": "China EV Export Brief",
      "section_id": "sec-01",
      "section_heading": "出口增长",
      "unit_kind": "section-summary",
      "language": "zh-CN",
      "text": "出口增长 2024 年中国新能源汽车出口继续增长，欧洲和东南亚是重点市场。 中国新能源汽车出口增长正在扩大海外市场覆盖。",
      "claims": [
        "中国新能源汽车出口增长正在扩大海外市场覆盖。"
      ],
      "source_binding": "src-01:sec-01"
    },
    {
      "unit_id": "src-01:sec-02",
      "source_id": "src-01",
      "source_title": "China EV Export Brief",
      "section_id": "sec-02",
      "section_heading": "政策影响",
      "unit_kind": "section-summary",
      "language": "zh-CN",
      "text": "政策影响 各国补贴、关税和本地化要求正在影响企业进入节奏。 政策约束已经成为出海节奏的核心变量。",
      "claims": [
        "政策约束已经成为出海节奏的核心变量。"
      ],
      "source_binding": "src-01:sec-02"
    },
    {
      "unit_id": "src-02:sec-01",
      "source_id": "src-02",
      "source_title": "Battery Cost Outlook",
      "section_id": "sec-01",
      "section_heading": "成本优势",
      "unit_kind": "section-summary",
      "language": "zh-CN",
      "text": "成本优势 电池成本下降仍然是中国品牌维持价格竞争力的关键因素。 电池成本优势仍是中国品牌国际定价能力的重要基础。",
      "claims": [
        "电池成本优势仍是中国品牌国际定价能力的重要基础。"
      ],
      "source_binding": "src-02:sec-01"
    }
  ]
}
