{
  "pack_id": "中国新能源汽车出海策略分析-b10b0ac5",
  "deck_goal": "基于「中国新能源汽车出海策略分析」生成结构化演示",
  "audience": "需要了解该主题的决策者和利益相关方",
  "source_units": [
    {
      "unit_id": "src-01:sec-01",
      "source_id": "src-01",
      "source_title": "中国新能源汽车出海策略分析",
      "section_id": "sec-01",
      "section_heading": "中国新能源汽车出海策略分析",
      "unit_kind": "section-summary",
      "language": "zh-CN",
      "text": "中国新能源汽车出海策略分析 本报告分析中国新能源汽车企业在欧洲和东南亚市场的出海策略，为决策者提供市场进入建议。 本报告分析中国新能源汽车企业在欧洲和东南亚市场的出海策略，为决策者提供市场进入建议",
      "claims": [
        "本报告分析中国新能源汽车企业在欧洲和东南亚市场的出海策略，为决策者提供市场进入建议"
      ],
      "source_binding": "src-01:sec-01"
    },
    {
      "unit_id": "src-02:sec-01",
      "source_id": "src-02",
      "source_title": "市场概况",
      "section_id": "sec-01",
      "section_heading": "全球新能源汽车市场趋势",
      "unit_kind": "section-summary",
      "language": "zh-CN",
      "text": "全球新能源汽车市场趋势 2023年全球新能源汽车销量达到1400万辆，同比增长35%。中国品牌在全球市场的份额从2021年的15%提升至2023年的28%。 关键数据： 中国已成为全球最大的新能源汽车出口国，2023年出口量超过120万辆。 2023年全球新能源汽车销量达到1400万辆，同比增长35% 中国品牌在全球市场的份额从2021年的15%提升至2023年的28% 2023年中国新能源汽车出口量：120.3万辆 同比增长：77.6% 主要出口目的地：欧洲（45%）、东南亚（25%）、中东（15%）",
      "claims": [
        "中国已成为全球最大的新能源汽车出口国，2023年出口量超过120万辆。",
        "2023年全球新能源汽车销量达到1400万辆，同比增长35%",
        "中国品牌在全球市场的份额从2021年的15%提升至2023年的28%",
        "2023年中国新能源汽车出口量：120.3万辆",
        "同比增长：77.6%",
        "主要出口目的地：欧洲（45%）、东南亚（25%）、中东（15%）"
      ],
      "source_binding": "src-02:sec-01"
    },
    {
      "unit_id": "src-02:sec-02",
      "source_id": "src-02",
      "source_title": "市场概况",
      "section_id": "sec-02",
      "section_heading": "竞争格局",
      "unit_kind": "section-summary",
      "language": "zh-CN",
      "text": "竞争格局",
      "claims": [],
      "source_binding": "src-02:sec-02"
    },
    {
      "unit_id": "src-03:sec-01",
      "source_id": "src-03",
      "source_title": "欧洲市场分析",
      "section_id": "sec-01",
      "section_heading": "机遇",
      "unit_kind": "section-summary",
      "language": "zh-CN",
      "text": "机遇 欧洲是全球第二大新能源汽车市场，2023年销量达到310万辆。欧盟的碳排放法规持续收紧，推动了电动化转型加速。 因此，欧洲市场为中国品牌提供了巨大的增长空间，特别是在15-30万元价格带。 欧洲是全球第二大新能源汽车市场，2023年销量达到310万辆 因此，欧洲市场为中国品牌提供了巨大的增长空间，特别是在15-30万元价格带",
      "claims": [
        "欧洲是全球第二大新能源汽车市场，2023年销量达到310万辆",
        "因此，欧洲市场为中国品牌提供了巨大的增长空间，特别是在15-30万元价格带"
      ],
      "source_binding": "src-03:sec-01"
    },
    {
      "unit_id": "src-03:sec-02",
      "source_id": "src-03",
      "source_title": "欧洲市场分析",
      "section_id": "sec-02",
      "section_heading": "挑战",
      "unit_kind": "section-summary",
      "language": "zh-CN",
      "text": "挑战 欧洲市场面临多重挑战： 建议采取\"先建品牌认知，再扩大销量\"的策略，避免陷入价格战。 关税壁垒：欧盟对中国电动汽车加征17.4%-38.1%的反补贴关税",
      "claims": [
        "建议采取\"先建品牌认知，再扩大销量\"的策略，避免陷入价格战。",
        "关税壁垒：欧盟对中国电动汽车加征17.4%-38.1%的反补贴关税"
      ],
      "source_binding": "src-03:sec-02"
    },
    {
      "unit_id": "src-04:sec-01",
      "source_id": "src-04",
      "source_title": "东南亚市场分析",
      "section_id": "sec-01",
      "section_heading": "市场特点",
      "unit_kind": "section-summary",
      "language": "zh-CN",
      "text": "市场特点 东南亚新能源汽车市场正处于快速增长期，2023年销量约50万辆，同比增长85%。泰国和印尼是最大的两个市场。 东南亚新能源汽车市场正处于快速增长期，2023年销量约50万辆，同比增长85% 泰国：政府补贴力度大，2023年EV渗透率达12%",
      "claims": [
        "东南亚新能源汽车市场正处于快速增长期，2023年销量约50万辆，同比增长85%",
        "泰国：政府补贴力度大，2023年EV渗透率达12%"
      ],
      "source_binding": "src-04:sec-01"
    },
    {
      "unit_id": "src-04:sec-02",
      "source_id": "src-04",
      "source_title": "东南亚市场分析",
      "section_id": "sec-02",
      "section_heading": "进入策略",
      "unit_kind": "section-summary",
      "language": "zh-CN",
      "text": "进入策略 建议采取分阶段进入策略： 关键成功因素是本地化合作伙伴的选择和供应链的本地化程度。 建议采取分阶段进入策略： 关键成功因素是本地化合作伙伴的选择和供应链的本地化程度",
      "claims": [
        "建议采取分阶段进入策略：",
        "关键成功因素是本地化合作伙伴的选择和供应链的本地化程度"
      ],
      "source_binding": "src-04:sec-02"
    },
    {
      "unit_id": "src-05:sec-01",
      "source_id": "src-05",
      "source_title": "成本与定价分析",
      "section_id": "sec-01",
      "section_heading": "成本与定价分析",
      "unit_kind": "section-summary",
      "language": "zh-CN",
      "text": "成本与定价分析 过去12个月动力电池包成本下降18%，为海外定价提供了更大的灵活空间。 因此，18%的电池成本降幅为价格带竞争和渠道投入提供了缓冲空间。 过去12个月动力电池包成本下降18%，为海外定价提供了更大的灵活空间 因此，18%的电池成本降幅为价格带竞争和渠道投入提供了缓冲空间",
      "claims": [
        "过去12个月动力电池包成本下降18%，为海外定价提供了更大的灵活空间",
        "因此，18%的电池成本降幅为价格带竞争和渠道投入提供了缓冲空间"
      ],
      "source_binding": "src-05:sec-01"
    },
    {
      "unit_id": "src-06:sec-01",
      "source_id": "src-06",
      "source_title": "总结与建议",
      "section_id": "sec-01",
      "section_heading": "总结与建议",
      "unit_kind": "section-summary",
      "language": "zh-CN",
      "text": "总结与建议 综合分析，建议中国新能源汽车企业采取以下策略： 综合分析，建议中国新能源汽车企业采取以下策略：",
      "claims": [
        "综合分析，建议中国新能源汽车企业采取以下策略："
      ],
      "source_binding": "src-06:sec-01"
    }
  ]
}
